{
  "published_at": "2026-10-15T12:53:38Z",
  "as_of": "2026-08",
  "legs": {
    "strict": {
      "provenance": "vintage-true (ALFRED as-of): each component takes its latest release known at the anchor date",
      "span": [
        "2018-01",
        "2026-08"
      ],
      "anchors_n": 101,
      "contains_downturn": false,
      "published_horizons": [
        12,
        24
      ],
      "grades": {
        "long_run": {
          "h12": {
            "n": 90,
            "independent_draws": 7.5,
            "shortfall_rate_pct": 62.2,
            "mean_shortfall_pp": 6.22,
            "worst_shortfall_pp": 18.9,
            "bias_pp": -3.57,
            "mae_pp": 4.17
          },
          "h24": {
            "n": 78,
            "independent_draws": 3.25,
            "shortfall_rate_pct": 75.6,
            "mean_shortfall_pp": 5.13,
            "worst_shortfall_pp": 13.26,
            "bias_pp": -3.75,
            "mae_pp": 4.01
          }
        },
        "trailing_3yr": {
          "h12": {
            "n": 90,
            "independent_draws": 7.5,
            "shortfall_rate_pct": 41.1,
            "mean_shortfall_pp": 7.54,
            "worst_shortfall_pp": 18.11,
            "bias_pp": -0.64,
            "mae_pp": 5.57
          },
          "h24": {
            "n": 78,
            "independent_draws": 3.25,
            "shortfall_rate_pct": 46.2,
            "mean_shortfall_pp": 6.12,
            "worst_shortfall_pp": 12.59,
            "bias_pp": -0.47,
            "mae_pp": 5.18
          }
        },
        "current_momentum": {
          "h12": {
            "n": 90,
            "independent_draws": 7.5,
            "shortfall_rate_pct": 50.0,
            "mean_shortfall_pp": 5.87,
            "worst_shortfall_pp": 19.22,
            "bias_pp": -0.3,
            "mae_pp": 5.57
          },
          "h24": {
            "n": 78,
            "independent_draws": 3.25,
            "shortfall_rate_pct": 51.3,
            "mean_shortfall_pp": 6.37,
            "worst_shortfall_pp": 14.62,
            "bias_pp": -0.01,
            "mae_pp": 6.53
          }
        }
      }
    },
    "extended": {
      "provenance": "final-revision throughout: deeper sample, at a measured 0.672pp maximum distortion across every anchor month both legs share",
      "span": [
        "2010-12",
        "2026-08"
      ],
      "anchors_n": 189,
      "contains_downturn": true,
      "published_horizons": [
        12,
        24,
        36,
        48
      ],
      "grades": {
        "long_run": {
          "h12": {
            "n": 177,
            "independent_draws": 14.75,
            "shortfall_rate_pct": 46.9,
            "mean_shortfall_pp": 4.98,
            "worst_shortfall_pp": 18.88,
            "bias_pp": -1.35,
            "mae_pp": 3.33
          },
          "h24": {
            "n": 165,
            "independent_draws": 6.875,
            "shortfall_rate_pct": 53.9,
            "mean_shortfall_pp": 4.16,
            "worst_shortfall_pp": 13.35,
            "bias_pp": -1.38,
            "mae_pp": 3.1
          },
          "h36": {
            "n": 153,
            "independent_draws": 4.25,
            "shortfall_rate_pct": 64.7,
            "mean_shortfall_pp": 3.55,
            "worst_shortfall_pp": 9.05,
            "bias_pp": -1.54,
            "mae_pp": 3.06
          },
          "h48": {
            "n": 141,
            "independent_draws": 2.9375,
            "shortfall_rate_pct": 65.2,
            "mean_shortfall_pp": 3.76,
            "worst_shortfall_pp": 7.01,
            "bias_pp": -1.74,
            "mae_pp": 3.17
          }
        },
        "trailing_3yr": {
          "h12": {
            "n": 177,
            "independent_draws": 14.75,
            "shortfall_rate_pct": 41.2,
            "mean_shortfall_pp": 5.22,
            "worst_shortfall_pp": 18.0,
            "bias_pp": -0.38,
            "mae_pp": 3.93
          },
          "h24": {
            "n": 165,
            "independent_draws": 6.875,
            "shortfall_rate_pct": 43.6,
            "mean_shortfall_pp": 4.54,
            "worst_shortfall_pp": 12.66,
            "bias_pp": -0.39,
            "mae_pp": 3.58
          },
          "h36": {
            "n": 153,
            "independent_draws": 4.25,
            "shortfall_rate_pct": 55.6,
            "mean_shortfall_pp": 3.8,
            "worst_shortfall_pp": 8.35,
            "bias_pp": -0.89,
            "mae_pp": 3.33
          },
          "h48": {
            "n": 141,
            "independent_draws": 2.9375,
            "shortfall_rate_pct": 66.0,
            "mean_shortfall_pp": 3.61,
            "worst_shortfall_pp": 6.45,
            "bias_pp": -1.61,
            "mae_pp": 3.14
          }
        },
        "current_momentum": {
          "h12": {
            "n": 177,
            "independent_draws": 14.75,
            "shortfall_rate_pct": 54.2,
            "mean_shortfall_pp": 3.92,
            "worst_shortfall_pp": 18.91,
            "bias_pp": -0.23,
            "mae_pp": 4.01
          },
          "h24": {
            "n": 165,
            "independent_draws": 6.875,
            "shortfall_rate_pct": 53.9,
            "mean_shortfall_pp": 4.23,
            "worst_shortfall_pp": 14.89,
            "bias_pp": -0.2,
            "mae_pp": 4.36
          },
          "h36": {
            "n": 153,
            "independent_draws": 4.25,
            "shortfall_rate_pct": 55.6,
            "mean_shortfall_pp": 3.83,
            "worst_shortfall_pp": 10.98,
            "bias_pp": -0.24,
            "mae_pp": 4.02
          },
          "h48": {
            "n": 141,
            "independent_draws": 2.9375,
            "shortfall_rate_pct": 70.2,
            "mean_shortfall_pp": 3.24,
            "worst_shortfall_pp": 8.94,
            "bias_pp": -0.53,
            "mae_pp": 4.03
          }
        }
      }
    }
  },
  "anchors": [
    {
      "m": "2018-01",
      "leg": "strict",
      "bases": {
        "long_run": 1.613,
        "trailing_3yr": 1.003,
        "current_momentum": 3.257
      },
      "realized": {
        "h12": 5.238,
        "h24": 3.236,
        "h36": 3.164,
        "h48": 7.282
      }
    },
    {
      "m": "2018-02",
      "leg": "strict",
      "bases": {
        "long_run": 1.632,
        "trailing_3yr": 1.208,
        "current_momentum": 3.122
      },
      "realized": {
        "h12": 4.317,
        "h24": 2.801,
        "h36": 3.27,
        "h48": 7.12
      }
    },
    {
      "m": "2018-03",
      "leg": "strict",
      "bases": {
        "long_run": 1.667,
        "trailing_3yr": 1.385,
        "current_momentum": 3.356
      },
      "realized": {
        "h12": 3.878,
        "h24": 2.422,
        "h36": 3.734,
        "h48": 7.284
      }
    },
    {
      "m": "2018-04",
      "leg": "strict",
      "bases": {
        "long_run": 1.729,
        "trailing_3yr": 1.776,
        "current_momentum": 3.759
      },
      "realized": {
        "h12": 3.769,
        "h24": 1.914,
        "h36": 4.298,
        "h48": 7.605
      }
    },
    {
      "m": "2018-05",
      "leg": "strict",
      "bases": {
        "long_run": 1.774,
        "trailing_3yr": 1.919,
        "current_momentum": 4.251
      },
      "realized": {
        "h12": 3.178,
        "h24": 1.477,
        "h36": 4.701,
        "h48": 7.884
      }
    },
    {
      "m": "2018-06",
      "leg": "strict",
      "bases": {
        "long_run": 1.81,
        "trailing_3yr": 2.259,
        "current_momentum": 4.559
      },
      "realized": {
        "h12": 2.216,
        "h24": 1.28,
        "h36": 5.259,
        "h48": 7.967
      }
    },
    {
      "m": "2018-07",
      "leg": "strict",
      "bases": {
        "long_run": 1.841,
        "trailing_3yr": 2.423,
        "current_momentum": 4.582
      },
      "realized": {
        "h12": 1.69,
        "h24": 1.182,
        "h36": 5.583,
        "h48": 7.88
      }
    },
    {
      "m": "2018-08",
      "leg": "strict",
      "bases": {
        "long_run": 1.864,
        "trailing_3yr": 2.674,
        "current_momentum": 4.975
      },
      "realized": {
        "h12": 1.388,
        "h24": 1.128,
        "h36": 5.898,
        "h48": 7.654
      }
    },
    {
      "m": "2018-09",
      "leg": "strict",
      "bases": {
        "long_run": 1.864,
        "trailing_3yr": 2.782,
        "current_momentum": 4.694
      },
      "realized": {
        "h12": 1.873,
        "h24": 1.431,
        "h36": 6.607,
        "h48": 7.61
      }
    },
    {
      "m": "2018-10",
      "leg": "strict",
      "bases": {
        "long_run": 1.889,
        "trailing_3yr": 2.954,
        "current_momentum": 4.974
      },
      "realized": {
        "h12": 1.288,
        "h24": 1.297,
        "h36": 6.972,
        "h48": 7.349
      }
    },
    {
      "m": "2018-11",
      "leg": "strict",
      "bases": {
        "long_run": 1.877,
        "trailing_3yr": 3.082,
        "current_momentum": 5.127
      },
      "realized": {
        "h12": 1.146,
        "h24": 1.462,
        "h36": 7.506,
        "h48": 7.327
      }
    },
    {
      "m": "2018-12",
      "leg": "strict",
      "bases": {
        "long_run": 1.883,
        "trailing_3yr": 3.277,
        "current_momentum": 5.291
      },
      "realized": {
        "h12": 1.061,
        "h24": 1.806,
        "h36": 7.605,
        "h48": 7.376
      }
    },
    {
      "m": "2019-02",
      "leg": "strict",
      "bases": {
        "long_run": 1.863,
        "trailing_3yr": 3.323,
        "current_momentum": 4.151
      },
      "realized": {
        "h12": 1.306,
        "h24": 2.751,
        "h36": 8.071,
        "h48": 7.788
      }
    },
    {
      "m": "2019-03",
      "leg": "strict",
      "bases": {
        "long_run": 1.897,
        "trailing_3yr": 3.388,
        "current_momentum": 4.09
      },
      "realized": {
        "h12": 0.986,
        "h24": 3.662,
        "h36": 8.444,
        "h48": 7.928
      }
    },
    {